{
  "$schema": "https://json-schema.org/draft/2020-12/schema",
  "$id": "https://github.com/clivingston33/benching/benchmark/schemas/comparison-v1.schema.json",
  "title": "Benching canonical run comparison (schema v1)",
  "description": "Portable comparison of independently analyzed runs. Embedded summaries are validated against the summary v1 contract by consumers (no cross-file $ref, so each file stays self-contained). Unknown extra fields are allowed and stripped by consumer projection, never rendered blindly.",
  "type": "object",
  "required": [
    "schema_version",
    "created_at_utc",
    "benchmark",
    "run_ids",
    "models",
    "execution_mode",
    "official_comparison",
    "tokenizers_comparable",
    "runs"
  ],
  "properties": {
    "schema_version": {
      "description": "Major contract version. Only 1 is supported; future majors are classified unsupported, never parsed as v1.",
      "const": 1
    },
    "comparison_id": {
      "description": "Stable identity for this comparison document (filename stem). Optional so older artifacts stay valid.",
      "type": "string",
      "minLength": 1
    },
    "created_at_utc": {
      "type": "string",
      "pattern": "^\\d{4}-\\d{2}-\\d{2}T\\d{2}:\\d{2}:\\d{2}"
    },
    "benchmark": {
      "type": "object",
      "required": ["name", "version"],
      "properties": {
        "name": {"type": "string"},
        "version": {"type": "string"}
      }
    },
    "run_ids": {
      "description": "Must match the embedded summaries' run ids in order.",
      "type": "array",
      "minItems": 1,
      "items": {"type": "string"}
    },
    "models": {
      "type": "array",
      "items": {"type": "string"}
    },
    "execution_mode": {"type": "string", "enum": ["sequential", "parallel"]},
    "official_comparison": {
      "description": "Sequential execution-protocol marker, not an endorsement of comparison fairness.",
      "type": "boolean"
    },
    "tokenizers_comparable": {
      "description": "Whether cross-run local-token metrics may be compared. False covers both known-different and unknown identities.",
      "type": "boolean"
    },
    "tokenizer_identity_status": {
      "description": "known_equal, known_different, or unknown (two missing identities are unknown, never proven equal). Optional so older artifacts stay valid.",
      "type": "string",
      "enum": ["known_equal", "known_different", "unknown"]
    },
    "runs": {
      "description": "Embedded independent run summaries, each validated against the summary v1 contract.",
      "type": "array",
      "minItems": 1,
      "items": {"type": "object"}
    }
  }
}
